{
  "meta": {
    "tier": "producer",
    "displayName": "Duke Strategies",
    "tagline": "Bridging Strategy and Impact",
    "industry": "Public Affairs / Consulting",
    "archetype": "sage",
    "domain": "dukestrategies.eu"
  },
  "colors": {
    "primary": "#FF7F66",
    "secondary": "#DFDFE0",
    "accent": "#FF7F66",
    "background": "#FFFFFF",
    "backgroundAlt": "#F5F5F5",
    "text": "#807F83",
    "textLight": "#DFDFE0",
    "success": "#4CAF50",
    "warning": "#FFC107",
    "error": "#DC3545"
  },
  "fonts": {
    "heading": {
      "family": "Montserrat",
      "fallback": "Arial, Helvetica, sans-serif",
      "weight": "600"
    },
    "body": {
      "family": "Montserrat",
      "fallback": "Arial, Helvetica, sans-serif",
      "weight": "normal"
    },
    "mono": {
      "family": "Space Mono",
      "fallback": "Courier New, monospace",
      "weight": "normal"
    }
  },
  "logo": {
    "primary": "logos/logo.png",
    "white": "logos/logo_white.png",
    "maxWidth": "120pt",
    "maxHeight": "50pt",
    "sizing": "contain"
  },
  "images": {
    "catalog": [
      {
        "file": "images/Erasmusbrug_zwart.jpg",
        "description": "Erasmus Bridge, Rotterdam — dramatic black and white night view",
        "roles": ["cover", "divider"]
      },
      {
        "file": "images/Nesciobrug.jpg",
        "description": "Nesciobrug, Amsterdam — moody pedestrian/cyclist bridge",
        "roles": ["divider", "closing"]
      },
      {
        "file": "images/Pythonbrug_Amsterdam_contrast.jpg",
        "description": "Python Bridge, Amsterdam — high-contrast architectural shot",
        "roles": ["divider"]
      },
      {
        "file": "images/shutterstock_1510566293_RoyalWelshbrug_zwart_1920x1280px_dark.jpg",
        "description": "Royal Welsh Bridge — dark moody bridge photography",
        "roles": ["cover", "closing"]
      }
    ],
    "overlay": {
      "color": "primary",
      "opacity": 0.55
    },
    "logoVariantOnImage": "white"
  },
  "document": {
    "margins": { "top": "1in", "bottom": "1in", "left": "1in", "right": "1in" },
    "header": { "content": "{{company.name}}", "logo": true },
    "footer": { "content": "Confidential", "pageNumbers": true },
    "headingColor": "primary",
    "tableHeaderColor": "primary"
  },
  "presentation": {
    "slideMargin": "40pt",
    "titleMargin": "30pt",
    "contentMargin": "20pt",
    "aspectRatio": "16:9"
  },
  "video": {
    "resolution": "1920x1080",
    "fps": 30
  },
  "website": {
    "archetype": "ruler",
    "aesthetic": "luxury",
    "layout": {
      "density": "airy",
      "symmetry": "symmetric",
      "flowDirection": "linear",
      "heroStyle": "full-bleed",
      "gridSystem": "12col-centered",
      "sectionSpacing": "generous",
      "sectionDividers": "thin-line",
      "footerStyle": "mega-footer",
      "whitespaceStrategy": "breathing"
    },
    "texture": {
      "backgroundTreatment": "solid",
      "surfaceFinish": "glossy",
      "borderStyle": "thin-line",
      "shadowDepth": "medium",
      "cornerRadius": "slight",
      "overlayStyle": "brand-tint",
      "patternDensity": "none"
    },
    "typography": {
      "headingStyle": "tight-sans",
      "headingScale": 1.2,
      "bodyLineHeight": 1.6,
      "letterSpacing": "wide",
      "textTransform": "uppercase-headings",
      "pullQuoteStyle": "bordered-left",
      "listStyle": "standard"
    },
    "motion": {
      "intensity": "subtle",
      "revealStyle": "fade",
      "scrollBehavior": "smooth",
      "hoverBehavior": "lift",
      "transitionSpeed": "relaxed",
      "loadingAnimation": "skeleton",
      "cursorStyle": "default"
    },
    "components": {
      "navigation": "top-bar-expanded",
      "cards": "shadow",
      "buttons": "square",
      "forms": "standard",
      "imagePresentation": "rectangular",
      "testimonials": "card-with-photo",
      "ctaStyle": "full-width-band",
      "socialProof": "logo-strip",
      "codeBlocks": "default"
    },
    "colorApplication": {
      "darkSections": true,
      "darkSectionFrequency": 3,
      "accentUsage": "sparring",
      "gradientDirection": "none",
      "colorBlockSections": true,
      "imageOverlayBehavior": "brand-tint"
    },
    "pages": {
      "home": {
        "enabled": true,
        "sections": [
          { "type": "hero", "variant": "full-bleed" },
          { "type": "social-proof", "variant": "logo-strip" },
          { "type": "service", "variant": "icon-grid" },
          { "type": "case-study", "variant": "featured-card" },
          { "type": "stats", "variant": "counter-band" },
          { "type": "testimonial", "variant": "card-with-photo" },
          { "type": "cta", "variant": "full-width-band" }
        ]
      },
      "who-we-are": { "enabled": true },
      "what-we-do": { "enabled": true },
      "duke-academy": { "enabled": true },
      "insights": { "enabled": true },
      "contact": { "enabled": true }
    },
    "deployment": {
      "platform": "github-pages",
      "domain": "dukestrategies.com",
      "analytics": "plausible",
      "contactForm": "none"
    },
    "i18n": {
      "enabled": true,
      "defaultLocale": "en",
      "locales": ["en", "nl"],
      "labels": { "en": "English", "nl": "Nederlands" },
      "routing": "prefix-default",
      "fallbackLocale": "en",
      "localeDetection": false,
      "translationWorkflow": "llm",
      "translateContentCollections": true
    }
  },
  "formatting": {
    "headingThreshold": 24,
    "accentCycleColors": ["accent", "secondary", "primary"],
    "autoContrastText": true
  },
  "plotly": {
    "categoricalPalette": ["#FF7F66", "#DFDFE0", "#807F83", "#4CAF50", "#FFC107"],
    "defaultHeight": 500,
    "titleFontSize": 18,
    "axisFontSize": 12,
    "legendFontSize": 11,
    "margins": { "top": 80, "bottom": 70, "left": 60, "right": 50 },
    "gridColor": "#e5e7eb",
    "secondaryTextColor": "#DFDFE0"
  }
}
